{"grant":{"api_version":"forgeos.capability-grant/v1","approval_refs":[],"authority_proof":{"issuer":{"authority_class":"forgeos_kernel","authority_domain":"forgeos.kernel.fixture","principal_id":"fixture-grant-issuer","principal_type":"service"},"key_id":"fixture-grant-issue-key-v1","proof_base64url":"jUQ8qfe-Z9oxedO0sEQ1fQGMItwi-qmBfeHAvb9luvD7uyZtIXHX2sUt4_fXIc8A10xPjofdBP5B22cv-Z9FDw","proof_profile_id":"forgeos.ed25519-domain-sha256/v1","proof_profile_sha256":"b4a3662880bddc7e49682d264f89ededa31804c9795cba447dd63ce591a8bf1b","trust_domain":"forgeos.kernel.fixture","trust_epoch":1},"bindings":{"context_sha256":"1111111111111111111111111111111111111111111111111111111111111111","grant_request_sha256":"c839335c5a37f1a7d1efe2fe69d145accf4e71add05aaf092dda0943fabb968f","impact_sha256":null,"plan_sha256":null,"policy_sha256":"d11e3b1e62056feba784f0183581eceb31a99401229e35a0bed277dc7982d803","risk_sha256":null,"source_revision":"fixture-revision-0057","source_tree_sha256":"7777777777777777777777777777777777777777777777777777777777777777"},"budget":{"max_calls":1,"max_cost_usd_micros":0,"max_input_tokens":0,"max_network_bytes":0,"max_output_bytes":131072,"max_output_tokens":0,"timeout_ms":30000},"canonicalization":"forgeos.canonical-json/v1","capability":{"capability_contract_sha256":"8888888888888888888888888888888888888888888888888888888888888888","capability_id":"repository-reader","capability_version":"1"},"effect_vocabulary_sha256":"a45de832e43ccdbebcb22f183575039d451594bfbc9ec713105c657a6adda49f","grant_id":"capability-grant-3ec289c184e8b1907aedd07e19874f839ef2d66170a4e4fced9cc5ef28dec8a7","grant_sha256":"3ec289c184e8b1907aedd07e19874f839ef2d66170a4e4fced9cc5ef28dec8a7","issuance_phase":"bootstrap_planning","kind":"CapabilityGrant","scope":{"allow":[{"resources":[{"match":"exact","path":".agent/ROADMAP.md","scope_kind":"repo_path"},{"match":"exact","path":"docs/adr/0057-authenticated-bootstrap-repo-read-grant-issuance.md","scope_kind":"repo_path"}]}],"deny":[],"effect_id":"repo.read"},"separation_of_duty":{"requester":{"authority_domain":"forgeos.kernel.fixture","principal_id":"fixture-bootstrap-requester","principal_type":"agent"},"required_distinctions":["issuer_not_requester","issuer_not_subject"]},"subject":{"authority_domain":"forgeos.kernel.fixture","principal_id":"fixture-bootstrap-requester","principal_type":"agent"},"task_binding":{"attempt_id":null,"change_id":"change-0057","environment_class":"development","environment_id":"fixture-development","node_id":"node-bootstrap-read","project_id":"forgeos","role":"bootstrap-planner","run_id":"run-bootstrap-grant-fixture","target_id":null,"task_id":"task-bootstrap-repo-read"},"usage_policy":{"atomic_reservation_required":true,"concurrent_use":"forbidden","consumption_mode":"single_use","replay":"receipt_only_no_reexecute","uncertain_effect":"quarantine","usage_ledger_required":true},"validity":{"expires_at_unix_ms":1700003602000,"issued_at_unix_ms":1700000002000,"not_before_unix_ms":1700000002000,"transferable":false}},"ledger":{"api_version":"forgeos.grant-issuance-ledger/v1","canonicalization":"forgeos.canonical-json/v1","clock_high_water_unix_ms":1700000002000,"entries":[{"grant":{"api_version":"forgeos.capability-grant/v1","approval_refs":[],"authority_proof":{"issuer":{"authority_class":"forgeos_kernel","authority_domain":"forgeos.kernel.fixture","principal_id":"fixture-grant-issuer","principal_type":"service"},"key_id":"fixture-grant-issue-key-v1","proof_base64url":"jUQ8qfe-Z9oxedO0sEQ1fQGMItwi-qmBfeHAvb9luvD7uyZtIXHX2sUt4_fXIc8A10xPjofdBP5B22cv-Z9FDw","proof_profile_id":"forgeos.ed25519-domain-sha256/v1","proof_profile_sha256":"b4a3662880bddc7e49682d264f89ededa31804c9795cba447dd63ce591a8bf1b","trust_domain":"forgeos.kernel.fixture","trust_epoch":1},"bindings":{"context_sha256":"1111111111111111111111111111111111111111111111111111111111111111","grant_request_sha256":"c839335c5a37f1a7d1efe2fe69d145accf4e71add05aaf092dda0943fabb968f","impact_sha256":null,"plan_sha256":null,"policy_sha256":"d11e3b1e62056feba784f0183581eceb31a99401229e35a0bed277dc7982d803","risk_sha256":null,"source_revision":"fixture-revision-0057","source_tree_sha256":"7777777777777777777777777777777777777777777777777777777777777777"},"budget":{"max_calls":1,"max_cost_usd_micros":0,"max_input_tokens":0,"max_network_bytes":0,"max_output_bytes":131072,"max_output_tokens":0,"timeout_ms":30000},"canonicalization":"forgeos.canonical-json/v1","capability":{"capability_contract_sha256":"8888888888888888888888888888888888888888888888888888888888888888","capability_id":"repository-reader","capability_version":"1"},"effect_vocabulary_sha256":"a45de832e43ccdbebcb22f183575039d451594bfbc9ec713105c657a6adda49f","grant_id":"capability-grant-3ec289c184e8b1907aedd07e19874f839ef2d66170a4e4fced9cc5ef28dec8a7","grant_sha256":"3ec289c184e8b1907aedd07e19874f839ef2d66170a4e4fced9cc5ef28dec8a7","issuance_phase":"bootstrap_planning","kind":"CapabilityGrant","scope":{"allow":[{"resources":[{"match":"exact","path":".agent/ROADMAP.md","scope_kind":"repo_path"},{"match":"exact","path":"docs/adr/0057-authenticated-bootstrap-repo-read-grant-issuance.md","scope_kind":"repo_path"}]}],"deny":[],"effect_id":"repo.read"},"separation_of_duty":{"requester":{"authority_domain":"forgeos.kernel.fixture","principal_id":"fixture-bootstrap-requester","principal_type":"agent"},"required_distinctions":["issuer_not_requester","issuer_not_subject"]},"subject":{"authority_domain":"forgeos.kernel.fixture","principal_id":"fixture-bootstrap-requester","principal_type":"agent"},"task_binding":{"attempt_id":null,"change_id":"change-0057","environment_class":"development","environment_id":"fixture-development","node_id":"node-bootstrap-read","project_id":"forgeos","role":"bootstrap-planner","run_id":"run-bootstrap-grant-fixture","target_id":null,"task_id":"task-bootstrap-repo-read"},"usage_policy":{"atomic_reservation_required":true,"concurrent_use":"forbidden","consumption_mode":"single_use","replay":"receipt_only_no_reexecute","uncertain_effect":"quarantine","usage_ledger_required":true},"validity":{"expires_at_unix_ms":1700003602000,"issued_at_unix_ms":1700000002000,"not_before_unix_ms":1700000002000,"transferable":false}},"policy":{"api_version":"forgeos.bootstrap-grant-policy/v1","budget":{"max_calls":1,"max_cost_usd_micros":0,"max_input_tokens":0,"max_network_bytes":0,"max_output_bytes":131072,"max_output_tokens":0,"timeout_ms":30000},"canonicalization":"forgeos.canonical-json/v1","capability":{"capability_contract_sha256":"8888888888888888888888888888888888888888888888888888888888888888","capability_id":"repository-reader","capability_version":"1"},"disposition":"allow","effect_id":"repo.read","kind":"BootstrapGrantPolicy","max_ttl_ms":3600000,"policy_id":"fixture-bootstrap-repo-read-policy-v1","policy_sha256":"d11e3b1e62056feba784f0183581eceb31a99401229e35a0bed277dc7982d803","profile_id":"bootstrap_planning_repo_read_only_v1","scope":{"allow":[{"resources":[{"match":"exact","path":".agent/ROADMAP.md","scope_kind":"repo_path"},{"match":"exact","path":"docs/adr/0057-authenticated-bootstrap-repo-read-grant-issuance.md","scope_kind":"repo_path"}]}],"deny":[],"effect_id":"repo.read"},"signature":{"key_id":"fixture-policy-sign-key-v1","profile_id":"forgeos.ed25519-domain-sha256/v1","profile_sha256":"b4a3662880bddc7e49682d264f89ededa31804c9795cba447dd63ce591a8bf1b","signature_base64url":"MDmn3TKvjNeF_tYZ5Tk7jTdz5boEcbrG0SUolHwWGYHZCjMkV6BcwaTuUJtfb9BcwjDLN60esIUXhl_LQD1pBA"},"subject":{"authority_domain":"forgeos.kernel.fixture","principal_id":"fixture-bootstrap-requester","principal_type":"agent"},"task_binding":{"attempt_id":null,"change_id":"change-0057","environment_class":"development","environment_id":"fixture-development","node_id":"node-bootstrap-read","project_id":"forgeos","role":"bootstrap-planner","run_id":"run-bootstrap-grant-fixture","target_id":null,"task_id":"task-bootstrap-repo-read"},"trust_epoch":1,"trust_root_sha256":"35b180615e7e4784e06d4c5618370904cd5b6824bc7e541bfeab62939891a27e","validity":{"expires_at_unix_ms":1700086400000,"not_before_unix_ms":1700000000000}},"receipt":{"api_version":"forgeos.grant-issuance-receipt/v1","canonicalization":"forgeos.canonical-json/v1","decision":"issued","denial_reason":null,"grant_envelope_sha256":"7a44527304c2a31e56b64ec88a6c6e4ef6f76c7a2dfc6775a59077b5205a6406","grant_id":"capability-grant-3ec289c184e8b1907aedd07e19874f839ef2d66170a4e4fced9cc5ef28dec8a7","grant_sha256":"3ec289c184e8b1907aedd07e19874f839ef2d66170a4e4fced9cc5ef28dec8a7","kind":"GrantIssuanceReceipt","ledger_sequence":1,"policy_sha256":"d11e3b1e62056feba784f0183581eceb31a99401229e35a0bed277dc7982d803","prior_receipt_sha256":null,"profile_id":"bootstrap_planning_repo_read_only_v1","receipt_sha256":"9943cf3fe469005d99b6932f496ac7c2c89ad541502350a49512ce8ec475131a","record_key_sha256":"5ba8334376963e5de657a4e174ebdaa39d28be07217f6a6eea8674e917bcacb4","request_sha256":"c839335c5a37f1a7d1efe2fe69d145accf4e71add05aaf092dda0943fabb968f","signature":{"key_id":"fixture-grant-issue-key-v1","profile_id":"forgeos.ed25519-domain-sha256/v1","profile_sha256":"b4a3662880bddc7e49682d264f89ededa31804c9795cba447dd63ce591a8bf1b","signature_base64url":"oNL_jYNF6wsNPdV1vgilx9_DgM_G70rT8-MC6mo4R3FpcU5R1HaOXu3Ek0gD3aUquUdYjUOT3DkYMJbprVO1DA"},"stored_at_unix_ms":1700000002000,"trust_epoch":1,"trust_root_sha256":"35b180615e7e4784e06d4c5618370904cd5b6824bc7e541bfeab62939891a27e"},"request":{"api_version":"forgeos.bootstrap-grant-request/v1","bindings":{"context_sha256":"1111111111111111111111111111111111111111111111111111111111111111","source_revision":"fixture-revision-0057","source_tree_sha256":"7777777777777777777777777777777777777777777777777777777777777777"},"budget":{"max_calls":1,"max_cost_usd_micros":0,"max_input_tokens":0,"max_network_bytes":0,"max_output_bytes":131072,"max_output_tokens":0,"timeout_ms":30000},"canonicalization":"forgeos.canonical-json/v1","capability":{"capability_contract_sha256":"88888888888888888888888888888888